[2026-02-28T01:18:20.499Z] ━━━━━━━━━━━━━━━━━━━━━━━━━━━━━━━━━━━━━━━━
[2026-02-28T01:18:20.499Z]   AI Workflow Automation - Starting
[2026-02-28T01:18:20.499Z] ━━━━━━━━━━━━━━━━━━━━━━━━━━━━━━━━━━━━━━━━
[2026-02-28T01:18:20.499Z] Stage: full
[2026-02-28T01:18:20.499Z] Mode: interactive
[2026-02-28T01:18:20.499Z] Detecting workflow profile based on changes...
[2026-02-28T01:18:20.507Z] Detected profile: full_validation
[2026-02-28T01:18:20.507Z]   Changed files: 193 (docs: 101, code: 1, tests: 0, infra: 4, other: 87)
[2026-02-28T01:18:20.507Z] Profile: full_validation
[2026-02-28T01:18:20.507Z] Performing health checks...
[2026-02-28T01:18:20.507Z] ✓ All health checks passed
[2026-02-28T01:18:20.507Z] Registering workflow steps...
[2026-02-28T01:18:20.507Z] [DEBUG] Registered step: step_00
[2026-02-28T01:18:20.507Z] [DEBUG] Registered step: step_0b
[2026-02-28T01:18:20.507Z] [DEBUG] Registered step: step_01
[2026-02-28T01:18:20.507Z] [DEBUG] Registered step: step_02
[2026-02-28T01:18:20.507Z] [DEBUG] Registered step: step_02_5
[2026-02-28T01:18:20.507Z] [DEBUG] Registered step: step_03
[2026-02-28T01:18:20.507Z] [DEBUG] Registered step: step_04
[2026-02-28T01:18:20.507Z] [DEBUG] Registered step: step_05
[2026-02-28T01:18:20.507Z] [DEBUG] Registered step: step_06
[2026-02-28T01:18:20.507Z] [DEBUG] Registered step: step_07
[2026-02-28T01:18:20.507Z] [DEBUG] Registered step: step_08
[2026-02-28T01:18:20.508Z] [DEBUG] Registered step: step_09
[2026-02-28T01:18:20.508Z] [DEBUG] Registered step: step_10
[2026-02-28T01:18:20.508Z] [DEBUG] Registered step: step_11
[2026-02-28T01:18:20.508Z] [DEBUG] Registered step: step_11_5
[2026-02-28T01:18:20.508Z] [DEBUG] Registered step: step_11_6
[2026-02-28T01:18:20.508Z] [DEBUG] Registered step: step_13
[2026-02-28T01:18:20.508Z] [DEBUG] Registered step: step_14
[2026-02-28T01:18:20.508Z] [DEBUG] Registered step: step_15
[2026-02-28T01:18:20.508Z] [DEBUG] Registered step: step_16
[2026-02-28T01:18:20.508Z] [DEBUG] Registered step: step_18
[2026-02-28T01:18:20.508Z] [DEBUG] Registered step: step_17
[2026-02-28T01:18:20.508Z] [DEBUG] Registered step: step_0f
[2026-02-28T01:18:20.508Z] [DEBUG] Registered step: step_12
[2026-02-28T01:18:20.508Z] ✓ Registered 24 workflow steps
[2026-02-28T01:18:20.508Z] Executing 24 steps for stage: full
[2026-02-28T01:18:20.508Z] [DEBUG] [CommitHistory] Loaded history; lastRunCommit=3dbaf2eb1ae50269d093b73b16118703d00a5bd2
[2026-02-28T01:18:20.514Z] [CommitHistory] 48 file(s) changed since last run (3dbaf2e)
[2026-02-28T01:18:20.521Z] Full optimization: Analyzing changes...
[2026-02-28T01:18:20.522Z] Docs-only analysis: NO (20.75% docs, 0% faster)
[2026-02-28T01:18:20.523Z] Code optimization: backend (0 steps skipped)
[2026-02-28T01:18:20.524Z] Full optimization: Selected strategy 'standard' (confidence: 30%)
[2026-02-28T01:18:20.524Z] 
Starting workflow execution...

[2026-02-28T01:18:20.536Z] [DEBUG] No model file found, starting fresh
[2026-02-28T01:18:20.536Z] ML Optimizer initialized
[2026-02-28T01:18:20.536Z] Loading workflow configuration...
[2026-02-28T01:18:20.536Z] ✓ Workflow loaded: AI Workflow Automation v2.0.0
[2026-02-28T01:18:20.536Z] Execution plan: 24 steps
[2026-02-28T01:18:20.537Z] Starting workflow execution: AI Workflow Automation
[2026-02-28T01:18:20.537Z] Executing step: Pre-Analysis (step_00)
[2026-02-28T01:18:20.537Z] [DEBUG] Prediction for step_00: skip (confidence: 0.95)
[2026-02-28T01:18:20.537Z] [DEBUG] [MLOptimizer] step_00: predicted skippable (confidence 0.95)
[2026-02-28T01:18:20.537Z] 
→ Starting: Pre-Analysis
[2026-02-28T01:18:20.538Z] ════════════════════════════════════════════════════════════
[2026-02-28T01:18:20.538Z] 🔷  Step 0: Pre-Analysis - Analyzing Recent Changes
[2026-02-28T01:18:20.538Z] ════════════════════════════════════════════════════════════
[2026-02-28T01:18:20.552Z] Commits ahead of remote: 0
[2026-02-28T01:18:20.552Z] Modified files: 193
[2026-02-28T01:18:20.556Z] ✓ Project kind from config: location_based_service (configured)
[2026-02-28T01:18:20.561Z] ✓ Pre-analysis complete:
  • Commits ahead: 0
  • Modified files: 193
  • Change scope: full-stack
  • Documentation: 6 files
  • Tests: 4 files
  • Source: 2 files
  • Config: 6 files
  • Project kind: location_based_service (100% confidence)

[2026-02-28T01:18:20.565Z] ✓ Step step_00 completed in 28ms
[2026-02-28T01:18:20.566Z] [DEBUG] [Performance] step_00: 28ms
[2026-02-28T01:18:20.566Z] [DEBUG] Recorded outcome for step_00: success
[2026-02-28T01:18:20.566Z] ✓ Completed: Pre-Analysis (0s)
[2026-02-28T01:18:20.566Z] Executing step: Bootstrap Documentation (step_0b)
[2026-02-28T01:18:20.566Z] [DEBUG] Prediction for step_0b: skip (confidence: 0.95)
[2026-02-28T01:18:20.566Z] [DEBUG] [MLOptimizer] step_0b: predicted skippable (confidence 0.95)
[2026-02-28T01:18:20.566Z] 
→ Starting: Bootstrap Documentation
[2026-02-28T01:18:20.566Z] [DEBUG] Step0bBootstrapDocs.execute()
[2026-02-28T01:18:20.567Z] ════════════════════════════════════════════════════════════
[2026-02-28T01:18:20.567Z] 🔷  Step 0b: Documentation Gap Analysis and Generation
[2026-02-28T01:18:20.567Z] ════════════════════════════════════════════════════════════
[2026-02-28T01:18:20.567Z] Phase 1: Gathering project statistics...
[2026-02-28T01:18:20.567Z] [DEBUG] Gathering project statistics by scanning files...
[2026-02-28T01:18:20.567Z] [DEBUG] Listing all files in the project directory...
[2026-02-28T01:18:20.567Z] [DEBUG] Project root: /home/mpb/Documents/GitHub/paraty_geocore.js
[2026-02-28T01:18:20.568Z] [DEBUG] Total files found: 60
[2026-02-28T01:18:20.568Z] [DEBUG] Converting to relative paths...
[2026-02-28T01:18:20.568Z] Project has 13 documentation files and 34 source files
[2026-02-28T01:18:20.568Z] README.md size: 2874 bytes, Has CHANGELOG: true, Has docs/ directory: true
[2026-02-28T01:18:20.568Z] Phase 2: Evaluating documentation coverage...
[2026-02-28T01:18:20.568Z] Step 0b: Documentation coverage adequate - no bootstrap needed
[2026-02-28T01:18:20.569Z] ✓ Step step_0b completed in 3ms
[2026-02-28T01:18:20.569Z] [DEBUG] [Performance] step_0b: 3ms
[2026-02-28T01:18:20.569Z] [DEBUG] Recorded outcome for step_0b: success
[2026-02-28T01:18:20.569Z] ✓ Completed: Bootstrap Documentation (0s)
[2026-02-28T01:18:20.569Z] Executing step: Documentation Updates (step_01)
[2026-02-28T01:18:20.569Z] [DEBUG] Prediction for step_01: skip (confidence: 0.95)
[2026-02-28T01:18:20.569Z] [DEBUG] [MLOptimizer] step_01: predicted skippable (confidence 0.95)
[2026-02-28T01:18:20.569Z] 
→ Starting: Documentation Updates
[2026-02-28T01:18:20.569Z] ════════════════════════════════════════════════════════════
[2026-02-28T01:18:20.569Z] 🔷  Step 1: AI-Powered Documentation Updates
[2026-02-28T01:18:20.569Z] ════════════════════════════════════════════════════════════
[2026-02-28T01:18:20.569Z] Changed files detected: 19 files
[2026-02-28T01:18:20.569Z] Classification: 6 docs, 0 source, 4 tests
[2026-02-28T01:18:20.569Z] Checking documentation changes (incremental mode)...
[2026-02-28T01:18:20.569Z] Step1: No cache found, starting fresh
[2026-02-28T01:18:20.570Z] [DEBUG] Step1: File no longer exists (skip): docs/GEOPOSITION_REFACTORING_SUMMARY.md
[2026-02-28T01:18:20.570Z] [DEBUG] Step1: File no longer exists (skip): docs/distance-FRS.md
[2026-02-28T01:18:20.570Z] Step1: Detected 4 changed files, 0 unchanged
[2026-02-28T01:18:20.571Z] ✓ Incremental: 2 docs unchanged (skipped)
[2026-02-28T01:18:20.571Z] Running documentation consistency validation...
[2026-02-28T01:18:22.112Z] ✓ GitHub Copilot SDK initialized successfully
[2026-02-28T01:18:23.236Z] Available Copilot models (13): claude-sonnet-4.5, claude-haiku-4.5, claude-opus-4.5, claude-sonnet-4, gemini-3-pro-preview, gpt-5.2-codex, gpt-5.2, gpt-5.1-codex-max, gpt-5.1-codex, gpt-5.1, gpt-5.1-codex-mini, gpt-5-mini, gpt-4.1
[2026-02-28T01:18:23.284Z] Cleaned up 42 expired cache entries
[2026-02-28T01:18:23.284Z] [DEBUG] AI cache initialized: .ai_workflow/.ai_cache
[2026-02-28T01:18:23.284Z] Running parallel documentation analysis...
[2026-02-28T01:18:23.284Z] Step1Parallel: Validating 4 files across 3 categories (BALANCED)
[2026-02-28T01:18:23.292Z] [DEBUG] Cache miss: 85535750...
[2026-02-28T01:18:23.292Z] [DEBUG] Request Options: {"model":"gpt-4.1","temperature":0.7,"maxTokens":4000,"stream":false,"persona":"documentation_expert","cache":true}
[2026-02-28T01:18:23.292Z] [DEBUG] Persona: documentation_expert
[2026-02-28T01:18:23.292Z] [DEBUG] Model: gpt-4.1
[2026-02-28T01:18:23.292Z] [AI] SDK call starting — persona: documentation_expert, model: gpt-4.1, prompt_chars: 2891
[2026-02-28T01:18:23.292Z] [DEBUG] Executing AI request (attempt 1/3)
[2026-02-28T01:18:23.292Z] [DEBUG] AiHelper._sendRequest called
[2026-02-28T01:18:23.292Z] [Copilot SDK] Calling sendMessage — model: gpt-4.1, prompt_length: 2891 chars
[2026-02-28T01:18:23.292Z] [DEBUG] Sending prompt...
[2026-02-28T01:18:46.484Z] [Copilot SDK] sendAndWait returned — model: gpt-4.1
[2026-02-28T01:18:46.485Z] [AI] SDK call completed — persona: documentation_expert, model: gpt-4.1, response_chars: 5505, latency: 23193ms
[2026-02-28T01:18:46.487Z] ✓ AI request completed successfully
[2026-02-28T01:18:46.488Z] [DEBUG] Prompt logged to: 2026-02-28T01-18-46-487Z_0001_documentation_expert.md
[2026-02-28T01:18:46.491Z] [DEBUG] Response cached: 85535750...
[2026-02-28T01:18:46.491Z] Step1Parallel: Validated readme (1 files) in 23s
[2026-02-28T01:18:46.496Z] [DEBUG] Cache miss: 161a323b...
[2026-02-28T01:18:46.496Z] [DEBUG] Request Options: {"model":"gpt-4.1","temperature":0.7,"maxTokens":4000,"stream":false,"persona":"documentation_expert","cache":true}
[2026-02-28T01:18:46.496Z] [DEBUG] Persona: documentation_expert
[2026-02-28T01:18:46.496Z] [DEBUG] Model: gpt-4.1
[2026-02-28T01:18:46.496Z] [AI] SDK call starting — persona: documentation_expert, model: gpt-4.1, prompt_chars: 2897
[2026-02-28T01:18:46.496Z] [DEBUG] Executing AI request (attempt 1/3)
[2026-02-28T01:18:46.496Z] [DEBUG] AiHelper._sendRequest called
[2026-02-28T01:18:46.496Z] [Copilot SDK] Calling sendMessage — model: gpt-4.1, prompt_length: 2897 chars
[2026-02-28T01:18:46.496Z] [DEBUG] Sending prompt...
[2026-02-28T01:19:42.390Z] [Copilot SDK] sendAndWait returned — model: gpt-4.1
[2026-02-28T01:19:42.390Z] [AI] SDK call completed — persona: documentation_expert, model: gpt-4.1, response_chars: 237, latency: 55894ms
[2026-02-28T01:19:42.390Z] ✓ AI request completed successfully
[2026-02-28T01:19:42.391Z] [DEBUG] Prompt logged to: 2026-02-28T01-19-42-390Z_0002_documentation_expert.md
[2026-02-28T01:19:42.395Z] [DEBUG] Response cached: 161a323b...
[2026-02-28T01:19:42.395Z] Step1Parallel: Validated contributing (1 files) in 56s
[2026-02-28T01:19:42.399Z] [DEBUG] Cache miss: 2677ba42...
[2026-02-28T01:19:42.399Z] [DEBUG] Request Options: {"model":"gpt-4.1","temperature":0.7,"maxTokens":4000,"stream":false,"persona":"documentation_expert","cache":true}
[2026-02-28T01:19:42.399Z] [DEBUG] Persona: documentation_expert
[2026-02-28T01:19:42.399Z] [DEBUG] Model: gpt-4.1
[2026-02-28T01:19:42.399Z] [AI] SDK call starting — persona: documentation_expert, model: gpt-4.1, prompt_chars: 2935
[2026-02-28T01:19:42.399Z] [DEBUG] Executing AI request (attempt 1/3)
[2026-02-28T01:19:42.399Z] [DEBUG] AiHelper._sendRequest called
[2026-02-28T01:19:42.399Z] [Copilot SDK] Calling sendMessage — model: gpt-4.1, prompt_length: 2935 chars
[2026-02-28T01:19:42.399Z] [DEBUG] Sending prompt...
[2026-02-28T01:21:42.406Z] ⚠ [AI] SDK call failed — persona: documentation_expert, model: gpt-4.1, error: Timeout after 120000ms waiting for session.idle
[2026-02-28T01:21:42.406Z] [AI] Retrying in 1000ms (attempt 2/3)...
[2026-02-28T01:21:44.820Z] [AI] Client and session recreated for retry
[2026-02-28T01:21:44.821Z] [AI] Timeout detected — increasing timeout to 240000ms for retry
[2026-02-28T01:21:44.821Z] [DEBUG] Executing AI request (attempt 2/3)
[2026-02-28T01:21:44.821Z] [DEBUG] AiHelper._sendRequest called
[2026-02-28T01:21:44.821Z] [Copilot SDK] Calling sendMessage — model: gpt-4.1, prompt_length: 2935 chars
[2026-02-28T01:21:44.821Z] [DEBUG] Sending prompt...
[2026-02-28T01:22:18.145Z] [Copilot SDK] sendAndWait returned — model: gpt-4.1
[2026-02-28T01:22:18.145Z] [AI] SDK call completed — persona: documentation_expert, model: gpt-4.1, response_chars: 7171, latency: 33324ms
[2026-02-28T01:22:18.146Z] ✓ AI request completed successfully
[2026-02-28T01:22:18.147Z] [DEBUG] Prompt logged to: 2026-02-28T01-22-18-146Z_0003_documentation_expert.md
[2026-02-28T01:22:18.150Z] [DEBUG] Response cached: 2677ba42...
[2026-02-28T01:22:18.150Z] Step1Parallel: Validated other (2 files) in 156s
[2026-02-28T01:22:18.150Z] Step1Parallel: Completed validation in 235s (4/4 files)
[2026-02-28T01:22:18.150Z] ✓ Parallel analysis completed: 4 docs in 235ms
[2026-02-28T01:22:18.150Z] ✓ Step 1 completed successfully
[2026-02-28T01:22:18.150Z] ✓ Step step_01 completed in 237581ms
[2026-02-28T01:22:18.150Z] [DEBUG] [Performance] step_01: 3m 58s
[2026-02-28T01:22:18.151Z] ✗ [CRITICAL] Operation 'step_01' took 3m 58s (memory: 16.11MB)
[2026-02-28T01:22:18.151Z] [DEBUG] Recorded outcome for step_01: success
[2026-02-28T01:22:18.151Z] ✓ Completed: Documentation Updates (238s)
[2026-02-28T01:22:18.151Z] Executing step: Configuration Validation (step_04)
[2026-02-28T01:22:18.151Z] [DEBUG] Prediction for step_04: skip (confidence: 0.95)
[2026-02-28T01:22:18.151Z] [DEBUG] [MLOptimizer] step_04: predicted skippable (confidence 0.95)
[2026-02-28T01:22:18.151Z] 
→ Starting: Configuration Validation
[2026-02-28T01:22:18.151Z] ════════════════════════════════════════════════════════════
[2026-02-28T01:22:18.151Z] 🔷  Step 4: Configuration Validation
[2026-02-28T01:22:18.151Z] ════════════════════════════════════════════════════════════
[2026-02-28T01:22:18.159Z] Found 7 configuration file(s)
[2026-02-28T01:22:18.162Z] Syntax validation: 0 error(s)
[2026-02-28T01:22:18.164Z] Security scan: 0 finding(s)
[2026-02-28T01:22:18.166Z] Best practices: 1 issue(s)
[2026-02-28T01:22:19.487Z] ✓ GitHub Copilot SDK initialized successfully
[2026-02-28T01:22:20.599Z] Available Copilot models (13): claude-sonnet-4.5, claude-haiku-4.5, claude-opus-4.5, claude-sonnet-4, gemini-3-pro-preview, gpt-5.2-codex, gpt-5.2, gpt-5.1-codex-max, gpt-5.1-codex, gpt-5.1, gpt-5.1-codex-mini, gpt-5-mini, gpt-4.1
[2026-02-28T01:22:20.634Z] [DEBUG] AI cache initialized: .ai_workflow/.ai_cache
[2026-02-28T01:22:20.641Z] [DEBUG] Cache miss: eab334d9...
[2026-02-28T01:22:20.641Z] [DEBUG] Request Options: {"model":"gpt-4.1","temperature":0.7,"maxTokens":4000,"stream":false,"persona":"devops_engineer","cache":true}
[2026-02-28T01:22:20.641Z] [DEBUG] Persona: devops_engineer
[2026-02-28T01:22:20.641Z] [DEBUG] Model: gpt-4.1
[2026-02-28T01:22:20.641Z] [AI] SDK call starting — persona: devops_engineer, model: gpt-4.1, prompt_chars: 3415
[2026-02-28T01:22:20.641Z] [DEBUG] Executing AI request (attempt 1/3)
[2026-02-28T01:22:20.641Z] [DEBUG] AiHelper._sendRequest called
[2026-02-28T01:22:20.641Z] [Copilot SDK] Calling sendMessage — model: gpt-4.1, prompt_length: 3415 chars
[2026-02-28T01:22:20.641Z] [DEBUG] Sending prompt...
[2026-02-28T01:22:37.702Z] [Copilot SDK] sendAndWait returned — model: gpt-4.1
[2026-02-28T01:22:37.703Z] [AI] SDK call completed — persona: devops_engineer, model: gpt-4.1, response_chars: 786, latency: 17062ms
[2026-02-28T01:22:37.703Z] ✓ AI request completed successfully
[2026-02-28T01:22:37.704Z] [DEBUG] Prompt logged to: 2026-02-28T01-22-37-704Z_0001_devops_engineer.md
[2026-02-28T01:22:37.707Z] [DEBUG] Response cached: eab334d9...
[2026-02-28T01:22:37.713Z] [DEBUG] Cache miss: a9fd54fe...
[2026-02-28T01:22:37.713Z] [DEBUG] Request Options: {"model":"gpt-4.1","temperature":0.7,"maxTokens":4000,"stream":false,"persona":"code_quality_analyst","cache":true}
[2026-02-28T01:22:37.713Z] [DEBUG] Persona: code_quality_analyst
[2026-02-28T01:22:37.713Z] [DEBUG] Model: gpt-4.1
[2026-02-28T01:22:37.713Z] [AI] SDK call starting — persona: code_quality_analyst, model: gpt-4.1, prompt_chars: 1582
[2026-02-28T01:22:37.713Z] [DEBUG] Executing AI request (attempt 1/3)
[2026-02-28T01:22:37.713Z] [DEBUG] AiHelper._sendRequest called
[2026-02-28T01:22:37.713Z] [Copilot SDK] Calling sendMessage — model: gpt-4.1, prompt_length: 1582 chars
[2026-02-28T01:22:37.713Z] [DEBUG] Sending prompt...
[2026-02-28T01:22:53.582Z] [Copilot SDK] sendAndWait returned — model: gpt-4.1
[2026-02-28T01:22:53.582Z] [AI] SDK call completed — persona: code_quality_analyst, model: gpt-4.1, response_chars: 4191, latency: 15869ms
[2026-02-28T01:22:53.583Z] ✓ AI request completed successfully
[2026-02-28T01:22:53.584Z] [DEBUG] Prompt logged to: 2026-02-28T01-22-53-583Z_0002_code_quality_analyst.md
[2026-02-28T01:22:53.587Z] [DEBUG] Response cached: a9fd54fe...
[2026-02-28T01:22:53.588Z] ✓ Step 4 completed - no issues found
[2026-02-28T01:22:53.588Z] ✓ Step step_04 completed in 35437ms
[2026-02-28T01:22:53.588Z] [DEBUG] [Performance] step_04: 35.4s
[2026-02-28T01:22:53.588Z] ✗ [CRITICAL] Operation 'step_04' took 35.4s (memory: 18.67MB)
[2026-02-28T01:22:53.588Z] [DEBUG] Recorded outcome for step_04: success
[2026-02-28T01:22:53.588Z] ✓ Completed: Configuration Validation (35s)
[2026-02-28T01:22:53.588Z] Executing step: Consistency Analysis (step_02)
[2026-02-28T01:22:53.589Z] [DEBUG] Prediction for step_02: skip (confidence: 0.95)
[2026-02-28T01:22:53.589Z] [DEBUG] [MLOptimizer] step_02: predicted skippable (confidence 0.95)
[2026-02-28T01:22:53.589Z] 
→ Starting: Consistency Analysis
[2026-02-28T01:22:53.589Z] ════════════════════════════════════════════════════════════
[2026-02-28T01:22:53.589Z] 🔷  Step 2: Documentation Consistency Analysis
[2026-02-28T01:22:53.589Z] ════════════════════════════════════════════════════════════
[2026-02-28T01:22:53.597Z] Found 10 documentation files
[2026-02-28T01:22:53.597Z] Expected version: 0.9.1-alpha
[2026-02-28T01:22:53.598Z] Version check: 11 issue(s) found
[2026-02-28T01:22:53.600Z] Link check: 3 broken link(s) found
[2026-02-28T01:22:54.917Z] ✓ GitHub Copilot SDK initialized successfully
[2026-02-28T01:22:56.031Z] Available Copilot models (13): claude-sonnet-4.5, claude-haiku-4.5, claude-opus-4.5, claude-sonnet-4, gemini-3-pro-preview, gpt-5.2-codex, gpt-5.2, gpt-5.1-codex-max, gpt-5.1-codex, gpt-5.1, gpt-5.1-codex-mini, gpt-5-mini, gpt-4.1
[2026-02-28T01:22:56.066Z] [DEBUG] AI cache initialized: .ai_workflow/.ai_cache
[2026-02-28T01:22:56.071Z] [DEBUG] Cache hit: 52aa57ea...
[2026-02-28T01:22:56.073Z] ⚠ Step 2 completed - 14 issue(s) found
[2026-02-28T01:22:56.073Z] ✓ Step step_02 completed in 2485ms
[2026-02-28T01:22:56.073Z] [DEBUG] [Performance] step_02: 2.5s
[2026-02-28T01:22:56.073Z] [DEBUG] Recorded outcome for step_02: success
[2026-02-28T01:22:56.073Z] ✓ Completed: Consistency Analysis (2s)
[2026-02-28T01:22:56.073Z] Executing step: Directory Structure (step_05)
[2026-02-28T01:22:56.073Z] [DEBUG] Prediction for step_05: skip (confidence: 0.95)
[2026-02-28T01:22:56.073Z] [DEBUG] [MLOptimizer] step_05: predicted skippable (confidence 0.95)
[2026-02-28T01:22:56.073Z] 
→ Starting: Directory Structure
[2026-02-28T01:22:56.074Z] ════════════════════════════════════════════════════════════
[2026-02-28T01:22:56.074Z] 🔷  Step 5: Directory Structure Validation
[2026-02-28T01:22:56.074Z] ════════════════════════════════════════════════════════════
[2026-02-28T01:22:56.074Z] Found 0 misplaced documentation file(s)
[2026-02-28T01:22:56.107Z] Structure validation: 6 issue(s)
[2026-02-28T01:22:57.369Z] ✓ GitHub Copilot SDK initialized successfully
[2026-02-28T01:22:58.487Z] Available Copilot models (13): claude-sonnet-4.5, claude-haiku-4.5, claude-opus-4.5, claude-sonnet-4, gemini-3-pro-preview, gpt-5.2-codex, gpt-5.2, gpt-5.1-codex-max, gpt-5.1-codex, gpt-5.1, gpt-5.1-codex-mini, gpt-5-mini, gpt-4.1
[2026-02-28T01:22:58.527Z] [DEBUG] AI cache initialized: .ai_workflow/.ai_cache
[2026-02-28T01:22:58.530Z] [DEBUG] Cache miss: c3e6feb0...
[2026-02-28T01:22:58.531Z] [DEBUG] Request Options: {"model":"gpt-4.1","temperature":0.7,"maxTokens":4000,"stream":false,"persona":"architecture_reviewer","cache":true}
[2026-02-28T01:22:58.531Z] [DEBUG] Persona: architecture_reviewer
[2026-02-28T01:22:58.531Z] [DEBUG] Model: gpt-4.1
[2026-02-28T01:22:58.531Z] [AI] SDK call starting — persona: architecture_reviewer, model: gpt-4.1, prompt_chars: 3472
[2026-02-28T01:22:58.531Z] [DEBUG] Executing AI request (attempt 1/3)
[2026-02-28T01:22:58.531Z] [DEBUG] AiHelper._sendRequest called
[2026-02-28T01:22:58.531Z] [Copilot SDK] Calling sendMessage — model: gpt-4.1, prompt_length: 3472 chars
[2026-02-28T01:22:58.531Z] [DEBUG] Sending prompt...
[2026-02-28T01:23:09.674Z] [Copilot SDK] sendAndWait returned — model: gpt-4.1
[2026-02-28T01:23:09.674Z] [AI] SDK call completed — persona: architecture_reviewer, model: gpt-4.1, response_chars: 5684, latency: 11143ms
[2026-02-28T01:23:09.675Z] ✓ AI request completed successfully
[2026-02-28T01:23:09.676Z] [DEBUG] Prompt logged to: 2026-02-28T01-23-09-675Z_0001_architecture_reviewer.md
[2026-02-28T01:23:09.679Z] [DEBUG] Response cached: c3e6feb0...
[2026-02-28T01:23:09.682Z] [DEBUG] Cache miss: 4749748d...
[2026-02-28T01:23:09.683Z] [DEBUG] Request Options: {"model":"gpt-4.1","temperature":0.7,"maxTokens":4000,"stream":false,"persona":"architecture_reviewer","cache":true}
[2026-02-28T01:23:09.683Z] [DEBUG] Persona: architecture_reviewer
[2026-02-28T01:23:09.683Z] [DEBUG] Model: gpt-4.1
[2026-02-28T01:23:09.683Z] [AI] SDK call starting — persona: architecture_reviewer, model: gpt-4.1, prompt_chars: 11326
[2026-02-28T01:23:09.683Z] [DEBUG] Executing AI request (attempt 1/3)
[2026-02-28T01:23:09.683Z] [DEBUG] AiHelper._sendRequest called
[2026-02-28T01:23:09.683Z] [Copilot SDK] Calling sendMessage — model: gpt-4.1, prompt_length: 11326 chars
[2026-02-28T01:23:09.683Z] [DEBUG] Sending prompt...
[2026-02-28T01:23:14.362Z] [Copilot SDK] sendAndWait returned — model: gpt-4.1
[2026-02-28T01:23:14.362Z] [AI] SDK call completed — persona: architecture_reviewer, model: gpt-4.1, response_chars: 1235, latency: 4679ms
[2026-02-28T01:23:14.362Z] ✓ AI request completed successfully
[2026-02-28T01:23:14.364Z] [DEBUG] Prompt logged to: 2026-02-28T01-23-14-363Z_0002_architecture_reviewer.md
[2026-02-28T01:23:14.369Z] [DEBUG] Response cached: 4749748d...
[2026-02-28T01:23:14.369Z] ⚠ Step 5 completed - 6 issue(s) found
[2026-02-28T01:23:14.369Z] ✓ Step step_05 completed in 18296ms
[2026-02-28T01:23:14.370Z] [DEBUG] [Performance] step_05: 18.3s
[2026-02-28T01:23:14.370Z] ⚠ [WARNING] Operation 'step_05' took 18.3s (memory: 22.29MB)
[2026-02-28T01:23:14.370Z] [DEBUG] Recorded outcome for step_05: success
[2026-02-28T01:23:14.370Z] ✓ Completed: Directory Structure (18s)
[2026-02-28T01:23:14.370Z] Executing step: Documentation Optimization (step_02_5)
[2026-02-28T01:23:14.370Z] [DEBUG] Prediction for step_02_5: skip (confidence: 0.95)
[2026-02-28T01:23:14.370Z] [DEBUG] [MLOptimizer] step_02_5: predicted skippable (confidence 0.95)
[2026-02-28T01:23:14.370Z] 
→ Starting: Documentation Optimization
[2026-02-28T01:23:14.370Z] Documentation optimization initialized
[2026-02-28T01:23:14.370Z] ════════════════════════════════════════════════════════════
[2026-02-28T01:23:14.370Z] 🔷  Step 2.5: Documentation Optimization
[2026-02-28T01:23:14.370Z] ════════════════════════════════════════════════════════════
[2026-02-28T01:23:14.371Z] Phase 1: Heuristics Analysis (8 files)
[2026-02-28T01:23:14.372Z] Calculating content hashes...
[2026-02-28T01:23:14.372Z] Found 0 duplicate groups (0 redundant files)
[2026-02-28T01:23:14.372Z] Analyzing document similarity...
[2026-02-28T01:23:14.378Z] Found 0 redundant pairs above 80% similarity
[2026-02-28T01:23:14.378Z] Found 0 exact duplicates, 0 redundant pairs
[2026-02-28T01:23:14.378Z] Phase 2: Git History Analysis
[2026-02-28T01:23:14.378Z] Analyzing git history for 8 files...
[2026-02-28T01:23:14.413Z] Completed git analysis for 8 files
[2026-02-28T01:23:14.413Z] Found 0 outdated files
[2026-02-28T01:23:14.413Z] Phase 3: Version Reference Analysis
[2026-02-28T01:23:14.416Z] Detected version from package.json: 0.9.1-alpha
[2026-02-28T01:23:14.416Z] Analyzing version references in 8 files (current: 0.9.1-alpha)...
[2026-02-28T01:23:14.418Z] Completed version analysis for 8 files
[2026-02-28T01:23:14.418Z] Version analysis complete (0 total outdated)
[2026-02-28T01:23:14.418Z] Phase 4: AI Edge Case Analysis (skipped - no AI analyzer)
[2026-02-28T01:23:14.418Z] Phase 5: Optimization Summary
[2026-02-28T01:23:14.418Z] 
📊 Analysis Results:
───────────────────
  Total files analyzed: 8
  Exact duplicates: 0
  Redundant pairs: 0
  Outdated files: 0
  Files to optimize: 0

[2026-02-28T01:23:14.418Z] No optimizations needed
[2026-02-28T01:23:14.418Z] ✓ Workflow complete (0s)
[2026-02-28T01:23:14.418Z] ✓ Step step_02_5 completed in 48ms
[2026-02-28T01:23:14.418Z] [DEBUG] [Performance] step_02_5: 48ms
[2026-02-28T01:23:14.418Z] [DEBUG] Recorded outcome for step_02_5: success
[2026-02-28T01:23:14.418Z] ✓ Completed: Documentation Optimization (0s)
[2026-02-28T01:23:14.418Z] Executing step: Script References (step_03)
[2026-02-28T01:23:14.418Z] [DEBUG] Prediction for step_03: skip (confidence: 0.95)
[2026-02-28T01:23:14.418Z] [DEBUG] [MLOptimizer] step_03: predicted skippable (confidence 0.95)
[2026-02-28T01:23:14.418Z] 
→ Starting: Script References
[2026-02-28T01:23:14.419Z] ════════════════════════════════════════════════════════════
[2026-02-28T01:23:14.419Z] 🔷  Step 3: Script Reference Validation
[2026-02-28T01:23:14.419Z] ════════════════════════════════════════════════════════════
[2026-02-28T01:23:14.422Z] Language: bash, patterns: *.sh
[2026-02-28T01:23:14.424Z] Found 2 script(s)
[2026-02-28T01:23:14.424Z] References: 0, missing: 0
[2026-02-28T01:23:14.424Z] Non-executable: 0
[2026-02-28T01:23:14.424Z] Undocumented: 2
[2026-02-28T01:23:15.699Z] ✓ GitHub Copilot SDK initialized successfully
[2026-02-28T01:23:16.744Z] Available Copilot models (13): claude-sonnet-4.5, claude-haiku-4.5, claude-opus-4.5, claude-sonnet-4, gemini-3-pro-preview, gpt-5.2-codex, gpt-5.2, gpt-5.1-codex-max, gpt-5.1-codex, gpt-5.1, gpt-5.1-codex-mini, gpt-5-mini, gpt-4.1
[2026-02-28T01:23:16.784Z] [DEBUG] AI cache initialized: .ai_workflow/.ai_cache
[2026-02-28T01:23:16.788Z] [DEBUG] Cache miss: fb64d57a...
[2026-02-28T01:23:16.788Z] [DEBUG] Request Options: {"model":"gpt-4.1","temperature":0.7,"maxTokens":4000,"stream":false,"persona":"devops_engineer","cache":true}
[2026-02-28T01:23:16.788Z] [DEBUG] Persona: devops_engineer
[2026-02-28T01:23:16.788Z] [DEBUG] Model: gpt-4.1
[2026-02-28T01:23:16.788Z] [AI] SDK call starting — persona: devops_engineer, model: gpt-4.1, prompt_chars: 4229
[2026-02-28T01:23:16.788Z] [DEBUG] Executing AI request (attempt 1/3)
[2026-02-28T01:23:16.788Z] [DEBUG] AiHelper._sendRequest called
[2026-02-28T01:23:16.788Z] [Copilot SDK] Calling sendMessage — model: gpt-4.1, prompt_length: 4229 chars
[2026-02-28T01:23:16.788Z] [DEBUG] Sending prompt...
[2026-02-28T01:23:33.205Z] [Copilot SDK] sendAndWait returned — model: gpt-4.1
[2026-02-28T01:23:33.205Z] [AI] SDK call completed — persona: devops_engineer, model: gpt-4.1, response_chars: 5110, latency: 16417ms
[2026-02-28T01:23:33.206Z] ✓ AI request completed successfully
[2026-02-28T01:23:33.208Z] [DEBUG] Prompt logged to: 2026-02-28T01-23-33-206Z_0001_devops_engineer.md
[2026-02-28T01:23:33.211Z] [DEBUG] Response cached: fb64d57a...
[2026-02-28T01:23:33.211Z] ⚠ Step 3 completed - 2 issue(s) found
[2026-02-28T01:23:33.211Z] ✓ Step step_03 completed in 18793ms
[2026-02-28T01:23:33.211Z] [DEBUG] [Performance] step_03: 18.8s
[2026-02-28T01:23:33.211Z] ⚠ [WARNING] Operation 'step_03' took 18.8s (memory: 17.55MB)
[2026-02-28T01:23:33.211Z] [DEBUG] Recorded outcome for step_03: success
[2026-02-28T01:23:33.211Z] ✓ Completed: Script References (19s)
[2026-02-28T01:23:33.211Z] Executing step: Test Review (step_06)
[2026-02-28T01:23:33.211Z] [DEBUG] Prediction for step_06: skip (confidence: 0.95)
[2026-02-28T01:23:33.211Z] [DEBUG] [MLOptimizer] step_06: predicted skippable (confidence 0.95)
[2026-02-28T01:23:33.212Z] 
→ Starting: Test Review
[2026-02-28T01:23:33.212Z] ════════════════════════════════════════════════════════════
[2026-02-28T01:23:33.212Z] 🔷  Step 6: Test Review
[2026-02-28T01:23:33.212Z] ════════════════════════════════════════════════════════════
[2026-02-28T01:23:33.217Z] Detected language: typescript
[2026-02-28T01:23:33.217Z] Found 4 test file(s) (from step_00 change detection)
[2026-02-28T01:23:33.217Z] Unit: 0, Integration: 0, E2E: 0
[2026-02-28T01:23:33.217Z] ⚠ No coverage reports found
[2026-02-28T01:23:34.646Z] ✓ GitHub Copilot SDK initialized successfully
[2026-02-28T01:23:35.760Z] Available Copilot models (13): claude-sonnet-4.5, claude-haiku-4.5, claude-opus-4.5, claude-sonnet-4, gemini-3-pro-preview, gpt-5.2-codex, gpt-5.2, gpt-5.1-codex-max, gpt-5.1-codex, gpt-5.1, gpt-5.1-codex-mini, gpt-5-mini, gpt-4.1
[2026-02-28T01:23:35.795Z] [DEBUG] AI cache initialized: .ai_workflow/.ai_cache
[2026-02-28T01:23:35.799Z] [DEBUG] Cache miss: 902401d8...
[2026-02-28T01:23:35.799Z] [DEBUG] Request Options: {"model":"gpt-4.1","temperature":0.7,"maxTokens":4000,"stream":false,"persona":"test_engineer","cache":true}
[2026-02-28T01:23:35.799Z] [DEBUG] Persona: test_engineer
[2026-02-28T01:23:35.799Z] [DEBUG] Model: gpt-4.1
[2026-02-28T01:23:35.799Z] [AI] SDK call starting — persona: test_engineer, model: gpt-4.1, prompt_chars: 3763
[2026-02-28T01:23:35.799Z] [DEBUG] Executing AI request (attempt 1/3)
[2026-02-28T01:23:35.799Z] [DEBUG] AiHelper._sendRequest called
[2026-02-28T01:23:35.799Z] [Copilot SDK] Calling sendMessage — model: gpt-4.1, prompt_length: 3763 chars
[2026-02-28T01:23:35.799Z] [DEBUG] Sending prompt...
[2026-02-28T01:23:43.035Z] [Copilot SDK] sendAndWait returned — model: gpt-4.1
[2026-02-28T01:23:43.035Z] [AI] SDK call completed — persona: test_engineer, model: gpt-4.1, response_chars: 213, latency: 7236ms
[2026-02-28T01:23:43.035Z] ✓ AI request completed successfully
[2026-02-28T01:23:43.036Z] [DEBUG] Prompt logged to: 2026-02-28T01-23-43-035Z_0001_test_engineer.md
[2026-02-28T01:23:43.038Z] [DEBUG] Response cached: 902401d8...
[2026-02-28T01:23:43.038Z] ⚠ Step 6 completed - 2 issue(s) identified
[2026-02-28T01:23:43.038Z] ✓ Step step_06 completed in 9827ms
[2026-02-28T01:23:43.039Z] [DEBUG] [Performance] step_06: 9.8s
[2026-02-28T01:23:43.039Z] ⚠ [WARNING] Operation 'step_06' took 9.8s (memory: 20.13MB)
[2026-02-28T01:23:43.039Z] [DEBUG] Recorded outcome for step_06: success
[2026-02-28T01:23:43.039Z] ✓ Completed: Test Review (10s)
[2026-02-28T01:23:43.039Z] Executing step: Test Generation (step_07)
[2026-02-28T01:23:43.039Z] [DEBUG] Prediction for step_07: skip (confidence: 0.95)
[2026-02-28T01:23:43.039Z] [DEBUG] [MLOptimizer] step_07: predicted skippable (confidence 0.95)
[2026-02-28T01:23:43.039Z] 
→ Starting: Test Generation
[2026-02-28T01:23:43.039Z] ════════════════════════════════════════════════════════════
[2026-02-28T01:23:43.039Z] 🔷  Step 7: Test Generation
[2026-02-28T01:23:43.039Z] ════════════════════════════════════════════════════════════
[2026-02-28T01:23:43.044Z] Detected language: typescript
[2026-02-28T01:23:43.047Z] Found 4 source file(s), 6 test file(s)
[2026-02-28T01:23:43.047Z] Identified 0 untested file(s)
[2026-02-28T01:23:43.047Z] Test coverage: 100%
[2026-02-28T01:23:43.047Z] ✓ Step 7 completed - all files have tests!
[2026-02-28T01:23:43.048Z] ✓ Step step_07 completed in 9ms
[2026-02-28T01:23:43.048Z] [DEBUG] [Performance] step_07: 9ms
[2026-02-28T01:23:43.048Z] [DEBUG] Recorded outcome for step_07: success
[2026-02-28T01:23:43.048Z] ✓ Completed: Test Generation (0s)
[2026-02-28T01:23:43.048Z] Executing step: Test Execution (step_08)
[2026-02-28T01:23:43.048Z] [DEBUG] Prediction for step_08: skip (confidence: 0.95)
[2026-02-28T01:23:43.048Z] [DEBUG] [MLOptimizer] step_08: predicted skippable (confidence 0.95)
[2026-02-28T01:23:43.048Z] 
→ Starting: Test Execution
[2026-02-28T01:23:43.048Z] ════════════════════════════════════════════════════════════
[2026-02-28T01:23:43.048Z] 🔷  Step 8: Test Execution
[2026-02-28T01:23:43.048Z] ════════════════════════════════════════════════════════════
[2026-02-28T01:23:43.051Z] Detected language: typescript
[2026-02-28T01:23:43.051Z] Test command: jest --testPathPattern='test/(core|integration|utils|index)' --passWithNoTests
[2026-02-28T01:23:43.055Z] Tests: 0 passed, 0 failed, 0 skipped
[2026-02-28T01:23:44.269Z] ✓ GitHub Copilot SDK initialized successfully
[2026-02-28T01:23:45.388Z] Available Copilot models (13): claude-sonnet-4.5, claude-haiku-4.5, claude-opus-4.5, claude-sonnet-4, gemini-3-pro-preview, gpt-5.2-codex, gpt-5.2, gpt-5.1-codex-max, gpt-5.1-codex, gpt-5.1, gpt-5.1-codex-mini, gpt-5-mini, gpt-4.1
[2026-02-28T01:23:45.425Z] [DEBUG] AI cache initialized: .ai_workflow/.ai_cache
[2026-02-28T01:23:45.427Z] [DEBUG] Cache miss: fc998269...
[2026-02-28T01:23:45.427Z] [DEBUG] Request Options: {"model":"gpt-4.1","temperature":0.7,"maxTokens":4000,"stream":false,"persona":"test_engineer","cache":true}
[2026-02-28T01:23:45.427Z] [DEBUG] Persona: test_engineer
[2026-02-28T01:23:45.427Z] [DEBUG] Model: gpt-4.1
[2026-02-28T01:23:45.427Z] [AI] SDK call starting — persona: test_engineer, model: gpt-4.1, prompt_chars: 3237
[2026-02-28T01:23:45.427Z] [DEBUG] Executing AI request (attempt 1/3)
[2026-02-28T01:23:45.427Z] [DEBUG] AiHelper._sendRequest called
[2026-02-28T01:23:45.427Z] [Copilot SDK] Calling sendMessage — model: gpt-4.1, prompt_length: 3237 chars
[2026-02-28T01:23:45.427Z] [DEBUG] Sending prompt...
[2026-02-28T01:23:55.839Z] [Copilot SDK] sendAndWait returned — model: gpt-4.1
[2026-02-28T01:23:55.840Z] [AI] SDK call completed — persona: test_engineer, model: gpt-4.1, response_chars: 3627, latency: 10413ms
[2026-02-28T01:23:55.840Z] ✓ AI request completed successfully
[2026-02-28T01:23:55.841Z] [DEBUG] Prompt logged to: 2026-02-28T01-23-55-840Z_0001_test_engineer.md
[2026-02-28T01:23:55.845Z] [DEBUG] Response cached: fc998269...
[2026-02-28T01:23:55.847Z] [DEBUG] Cache miss: a30f3a2c...
[2026-02-28T01:23:55.847Z] [DEBUG] Request Options: {"model":"gpt-4.1","temperature":0.7,"maxTokens":4000,"stream":false,"persona":"test_engineer","cache":true}
[2026-02-28T01:23:55.847Z] [DEBUG] Persona: test_engineer
[2026-02-28T01:23:55.847Z] [DEBUG] Model: gpt-4.1
[2026-02-28T01:23:55.847Z] [AI] SDK call starting — persona: test_engineer, model: gpt-4.1, prompt_chars: 9181
[2026-02-28T01:23:55.847Z] [DEBUG] Executing AI request (attempt 1/3)
[2026-02-28T01:23:55.847Z] [DEBUG] AiHelper._sendRequest called
[2026-02-28T01:23:55.847Z] [Copilot SDK] Calling sendMessage — model: gpt-4.1, prompt_length: 9181 chars
[2026-02-28T01:23:55.847Z] [DEBUG] Sending prompt...
[2026-02-28T01:24:11.631Z] [Copilot SDK] sendAndWait returned — model: gpt-4.1
[2026-02-28T01:24:11.631Z] [AI] SDK call completed — persona: test_engineer, model: gpt-4.1, response_chars: 6627, latency: 15784ms
[2026-02-28T01:24:11.632Z] ✓ AI request completed successfully
[2026-02-28T01:24:11.633Z] [DEBUG] Prompt logged to: 2026-02-28T01-24-11-632Z_0002_test_engineer.md
[2026-02-28T01:24:11.638Z] [DEBUG] Response cached: a30f3a2c...
[2026-02-28T01:24:11.639Z] ⚠ Step 8 completed - no tests found
[2026-02-28T01:24:11.639Z] ✓ Step step_08 completed in 28591ms
[2026-02-28T01:24:11.639Z] [DEBUG] [Performance] step_08: 28.6s
[2026-02-28T01:24:11.639Z] ⚠ [WARNING] Operation 'step_08' took 28.6s (memory: 20.83MB)
[2026-02-28T01:24:11.639Z] [DEBUG] Recorded outcome for step_08: success
[2026-02-28T01:24:11.639Z] ✓ Completed: Test Execution (29s)
[2026-02-28T01:24:11.639Z] Executing step: Dependency Analysis (step_09)
[2026-02-28T01:24:11.639Z] [DEBUG] Prediction for step_09: skip (confidence: 0.95)
[2026-02-28T01:24:11.639Z] [DEBUG] [MLOptimizer] step_09: predicted skippable (confidence 0.95)
[2026-02-28T01:24:11.639Z] 
→ Starting: Dependency Analysis
[2026-02-28T01:24:11.640Z] ════════════════════════════════════════════════════════════
[2026-02-28T01:24:11.640Z] 🔷  Step 9: Dependency Validation
[2026-02-28T01:24:11.640Z] ════════════════════════════════════════════════════════════
[2026-02-28T01:24:11.646Z] Detected language: typescript
[2026-02-28T01:24:11.646Z] Found dependency files: package.json, package-lock.json
[2026-02-28T01:24:11.646Z] Total dependencies: 4
[2026-02-28T01:24:12.137Z] ✓ No vulnerabilities found
[2026-02-28T01:24:14.275Z] ✓ GitHub Copilot SDK initialized successfully
[2026-02-28T01:24:15.077Z] Available Copilot models (13): claude-sonnet-4.5, claude-haiku-4.5, claude-opus-4.5, claude-sonnet-4, gemini-3-pro-preview, gpt-5.2-codex, gpt-5.2, gpt-5.1-codex-max, gpt-5.1-codex, gpt-5.1, gpt-5.1-codex-mini, gpt-5-mini, gpt-4.1
[2026-02-28T01:24:15.114Z] [DEBUG] AI cache initialized: .ai_workflow/.ai_cache
[2026-02-28T01:24:15.117Z] [DEBUG] Cache miss: b2a387b4...
[2026-02-28T01:24:15.118Z] [DEBUG] Request Options: {"model":"gpt-4.1","temperature":0.7,"maxTokens":4000,"stream":false,"persona":"dependency_analyst","cache":true}
[2026-02-28T01:24:15.118Z] [DEBUG] Persona: dependency_analyst
[2026-02-28T01:24:15.118Z] [DEBUG] Model: gpt-4.1
[2026-02-28T01:24:15.118Z] [AI] SDK call starting — persona: dependency_analyst, model: gpt-4.1, prompt_chars: 3233
[2026-02-28T01:24:15.118Z] [DEBUG] Executing AI request (attempt 1/3)
[2026-02-28T01:24:15.118Z] [DEBUG] AiHelper._sendRequest called
[2026-02-28T01:24:15.118Z] [Copilot SDK] Calling sendMessage — model: gpt-4.1, prompt_length: 3233 chars
[2026-02-28T01:24:15.118Z] [DEBUG] Sending prompt...
[2026-02-28T01:24:21.337Z] [Copilot SDK] sendAndWait returned — model: gpt-4.1
[2026-02-28T01:24:21.337Z] [AI] SDK call completed — persona: dependency_analyst, model: gpt-4.1, response_chars: 1873, latency: 6219ms
[2026-02-28T01:24:21.338Z] ✓ AI request completed successfully
[2026-02-28T01:24:21.339Z] [DEBUG] Prompt logged to: 2026-02-28T01-24-21-338Z_0001_dependency_analyst.md
[2026-02-28T01:24:21.341Z] [DEBUG] Response cached: b2a387b4...
[2026-02-28T01:24:21.345Z] [DEBUG] Cache hit: dac79328...
[2026-02-28T01:24:21.375Z] ✓ Step 9 completed - dependencies validated!
[2026-02-28T01:24:21.375Z] ✓ Step step_09 completed in 9736ms
[2026-02-28T01:24:21.375Z] [DEBUG] [Performance] step_09: 9.7s
[2026-02-28T01:24:21.375Z] ⚠ [WARNING] Operation 'step_09' took 9.7s (memory: 22.98MB)
[2026-02-28T01:24:21.375Z] [DEBUG] Recorded outcome for step_09: success
[2026-02-28T01:24:21.375Z] ✓ Completed: Dependency Analysis (10s)
[2026-02-28T01:24:21.375Z] Executing step: Code Quality (step_10)
[2026-02-28T01:24:21.375Z] [DEBUG] Prediction for step_10: skip (confidence: 0.95)
[2026-02-28T01:24:21.375Z] [DEBUG] [MLOptimizer] step_10: predicted skippable (confidence 0.95)
[2026-02-28T01:24:21.375Z] 
→ Starting: Code Quality
[2026-02-28T01:24:21.376Z] ════════════════════════════════════════════════════════════
[2026-02-28T01:24:21.376Z] 🔷  Step 10: Code Quality Analysis
[2026-02-28T01:24:21.376Z] ════════════════════════════════════════════════════════════
[2026-02-28T01:24:21.380Z] Detected languages: typescript, markdown, html, json, javascript, yaml, bash, css
[2026-02-28T01:24:21.383Z] typescript: 11 source file(s), linter: npm run lint
[2026-02-28T01:24:21.383Z] [DEBUG] [AnalysisCache] Cache miss: linter_61005aca
[2026-02-28T01:24:21.507Z] [DEBUG] [AnalysisCache] Cached: linter_61005aca (51 bytes)
[2026-02-28T01:24:21.507Z] ✓ typescript: no issues
[2026-02-28T01:24:21.508Z] json: 3 source file(s), linter: (native JSON.parse)
[2026-02-28T01:24:21.508Z] [DEBUG] [AnalysisCache] Cache miss: linter_7855b3cd
[2026-02-28T01:24:21.510Z] [DEBUG] [AnalysisCache] Cached: linter_7855b3cd (51 bytes)
[2026-02-28T01:24:21.510Z] ✓ json: no issues
[2026-02-28T01:24:21.512Z] javascript: 1 source file(s), linter: npm run lint
[2026-02-28T01:24:21.512Z] [DEBUG] [AnalysisCache] Cache miss: linter_cc88b499
[2026-02-28T01:24:21.641Z] [DEBUG] [AnalysisCache] Cached: linter_cc88b499 (51 bytes)
[2026-02-28T01:24:21.641Z] ✓ javascript: no issues
[2026-02-28T01:24:21.644Z] bash: 2 source file(s), linter: find . -name "*.sh" -not -path "*/node_modules/*" -not -path "*/.git/*" | xargs shellcheck
[2026-02-28T01:24:21.644Z] [DEBUG] [AnalysisCache] Cache miss: linter_0416b259
[2026-02-28T01:24:21.754Z] [DEBUG] [AnalysisCache] Cached: linter_0416b259 (51 bytes)
[2026-02-28T01:24:21.754Z] ✓ bash: no issues
[2026-02-28T01:24:21.755Z] Total: 0 issue(s) across 4 language(s)
[2026-02-28T01:24:22.978Z] ✓ GitHub Copilot SDK initialized successfully
[2026-02-28T01:24:24.405Z] Available Copilot models (13): claude-sonnet-4.5, claude-haiku-4.5, claude-opus-4.5, claude-sonnet-4, gemini-3-pro-preview, gpt-5.2-codex, gpt-5.2, gpt-5.1-codex-max, gpt-5.1-codex, gpt-5.1, gpt-5.1-codex-mini, gpt-5-mini, gpt-4.1
[2026-02-28T01:24:24.440Z] [DEBUG] AI cache initialized: .ai_workflow/.ai_cache
[2026-02-28T01:24:24.441Z] [DEBUG] [Step10Partition] File set changed or no cache — resetting partition index to 0
[2026-02-28T01:24:24.442Z] Reviewing partition 1/1 (17 files): test, test/utils, test/integration, test/core, test/benchmarks, src, src/utils, src/core, package-lock.json, package.json, tsconfig.json, jest.config.js, cdn-delivery.sh, scripts
[2026-02-28T01:24:24.452Z] [DEBUG] Cache miss: 5e6c3bc7...
[2026-02-28T01:24:24.452Z] [DEBUG] Request Options: {"model":"gpt-4.1","temperature":0.7,"maxTokens":4000,"stream":false,"persona":"code_quality_analyst","cache":true,"timeout":240000}
[2026-02-28T01:24:24.452Z] [DEBUG] Persona: code_quality_analyst
[2026-02-28T01:24:24.452Z] [DEBUG] Model: gpt-4.1
[2026-02-28T01:24:24.452Z] [AI] SDK call starting — persona: code_quality_analyst, model: gpt-4.1, prompt_chars: 6410
[2026-02-28T01:24:24.452Z] [DEBUG] Executing AI request (attempt 1/3)
[2026-02-28T01:24:24.452Z] [DEBUG] AiHelper._sendRequest called
[2026-02-28T01:24:24.452Z] [Copilot SDK] Calling sendMessage — model: gpt-4.1, prompt_length: 6410 chars
[2026-02-28T01:24:24.452Z] [DEBUG] Sending prompt...
[2026-02-28T01:24:33.007Z] [Copilot SDK] sendAndWait returned — model: gpt-4.1
[2026-02-28T01:24:33.007Z] [AI] SDK call completed — persona: code_quality_analyst, model: gpt-4.1, response_chars: 2135, latency: 8555ms
[2026-02-28T01:24:33.007Z] ✓ AI request completed successfully
[2026-02-28T01:24:33.040Z] [DEBUG] Prompt logged to: 2026-02-28T01-24-33-039Z_0001_code_quality_analyst.md
[2026-02-28T01:24:33.043Z] [DEBUG] Response cached: 5e6c3bc7...
[2026-02-28T01:24:33.047Z] [DEBUG] Cache miss: da9d6759...
[2026-02-28T01:24:33.047Z] [DEBUG] Request Options: {"model":"gpt-4.1","temperature":0.7,"maxTokens":4000,"stream":false,"persona":"code_quality_analyst","cache":true,"timeout":240000}
[2026-02-28T01:24:33.047Z] [DEBUG] Persona: code_quality_analyst
[2026-02-28T01:24:33.047Z] [DEBUG] Model: gpt-4.1
[2026-02-28T01:24:33.047Z] [AI] SDK call starting — persona: code_quality_analyst, model: gpt-4.1, prompt_chars: 5830
[2026-02-28T01:24:33.047Z] [DEBUG] Executing AI request (attempt 1/3)
[2026-02-28T01:24:33.047Z] [DEBUG] AiHelper._sendRequest called
[2026-02-28T01:24:33.047Z] [Copilot SDK] Calling sendMessage — model: gpt-4.1, prompt_length: 5830 chars
[2026-02-28T01:24:33.047Z] [DEBUG] Sending prompt...
[2026-02-28T01:24:40.747Z] [Copilot SDK] sendAndWait returned — model: gpt-4.1
[2026-02-28T01:24:40.748Z] [AI] SDK call completed — persona: code_quality_analyst, model: gpt-4.1, response_chars: 2159, latency: 7701ms
[2026-02-28T01:24:40.748Z] ✓ AI request completed successfully
[2026-02-28T01:24:40.749Z] [DEBUG] Prompt logged to: 2026-02-28T01-24-40-748Z_0002_code_quality_analyst.md
[2026-02-28T01:24:40.753Z] [DEBUG] Response cached: da9d6759...
[2026-02-28T01:24:40.754Z] [DEBUG] [Step10Partition] Advanced index 0 → 0/0
[2026-02-28T01:24:40.754Z] ✓ Step 10 completed - code quality validated!
[2026-02-28T01:24:40.754Z] ✓ Step step_10 completed in 19379ms
[2026-02-28T01:24:40.754Z] [DEBUG] [Performance] step_10: 19.4s
[2026-02-28T01:24:40.755Z] ⚠ [WARNING] Operation 'step_10' took 19.4s (memory: 20.11MB)
[2026-02-28T01:24:40.755Z] [DEBUG] Recorded outcome for step_10: success
[2026-02-28T01:24:40.755Z] ✓ Completed: Code Quality (19s)
[2026-02-28T01:24:40.755Z] Executing step: Context Management (step_11)
[2026-02-28T01:24:40.755Z] [DEBUG] Prediction for step_11: skip (confidence: 0.95)
[2026-02-28T01:24:40.755Z] [DEBUG] [MLOptimizer] step_11: predicted skippable (confidence 0.95)
[2026-02-28T01:24:40.755Z] 
→ Starting: Context Management
[2026-02-28T01:24:40.755Z] ════════════════════════════════════════════════════════════
[2026-02-28T01:24:40.755Z] 🔷  Step 11: Context Analysis
[2026-02-28T01:24:40.755Z] ════════════════════════════════════════════════════════════
[2026-02-28T01:24:40.755Z] Workflow completion: 100% (13/13)
[2026-02-28T01:24:40.772Z] Git state: 0 modified, 0 staged
[2026-02-28T01:24:40.808Z] Change impact: low (score: 0)
[2026-02-28T01:24:40.808Z] Issues: 0 total, 0 critical
[2026-02-28T01:24:40.808Z] Workflow duration: 6m 20s
[2026-02-28T01:24:40.809Z] ✓ Step 11 completed - workflow context analyzed!
[2026-02-28T01:24:40.809Z] ✓ Step step_11 completed in 54ms
[2026-02-28T01:24:40.809Z] [DEBUG] [Performance] step_11: 54ms
[2026-02-28T01:24:40.809Z] [DEBUG] Recorded outcome for step_11: success
[2026-02-28T01:24:40.809Z] ✓ Completed: Context Management (0s)
[2026-02-28T01:24:40.809Z] Executing step: AWS LBS Validation (step_11_5)
[2026-02-28T01:24:40.809Z] [DEBUG] Prediction for step_11_5: skip (confidence: 0.95)
[2026-02-28T01:24:40.809Z] [DEBUG] [MLOptimizer] step_11_5: predicted skippable (confidence 0.95)
[2026-02-28T01:24:40.809Z] 
→ Starting: AWS LBS Validation
[2026-02-28T01:24:40.810Z] ════════════════════════════════════════════════════════════
[2026-02-28T01:24:40.810Z] 🔷  Step 11.5: AWS LBS Backend Validation
[2026-02-28T01:24:40.810Z] ════════════════════════════════════════════════════════════
[2026-02-28T01:24:40.810Z] Step 11.5 skipped — project kind 'location_based_service' is not aws_lbs_backend_setup
[2026-02-28T01:24:40.811Z] ✓ Step step_11_5 completed in 2ms
[2026-02-28T01:24:40.811Z] [DEBUG] [Performance] step_11_5: 2ms
[2026-02-28T01:24:40.811Z] [DEBUG] Recorded outcome for step_11_5: success
[2026-02-28T01:24:40.811Z] ✓ Completed: AWS LBS Validation (0s)
[2026-02-28T01:24:40.811Z] Executing step: Markdown Linting (step_13)
[2026-02-28T01:24:40.811Z] [DEBUG] Prediction for step_13: skip (confidence: 0.95)
[2026-02-28T01:24:40.811Z] [DEBUG] [MLOptimizer] step_13: predicted skippable (confidence 0.95)
[2026-02-28T01:24:40.811Z] 
→ Starting: Markdown Linting
[2026-02-28T01:24:40.811Z] ════════════════════════════════════════════════════════════
[2026-02-28T01:24:40.811Z] 🔷  Step 13: Markdown Linting
[2026-02-28T01:24:40.811Z] ════════════════════════════════════════════════════════════
[2026-02-28T01:24:40.811Z] Enumerating markdown files...
[2026-02-28T01:24:40.814Z] Found 39 markdown files
[2026-02-28T01:24:40.814Z] Checking for mdl (markdownlint)...
[2026-02-28T01:24:40.910Z] mdl is installed: 0.13.0
[2026-02-28T01:24:40.911Z] Running mdl on all markdown files...
[2026-02-28T01:24:41.224Z] ⚠ Found 840 markdown linting violations
[2026-02-28T01:24:41.224Z] Checking for common markdown anti-patterns...
[2026-02-28T01:24:41.230Z] ⚠ Detected 266 anti-pattern occurrences
[2026-02-28T01:24:42.536Z] ✓ GitHub Copilot SDK initialized successfully
[2026-02-28T01:24:43.546Z] Available Copilot models (13): claude-sonnet-4.5, claude-haiku-4.5, claude-opus-4.5, claude-sonnet-4, gemini-3-pro-preview, gpt-5.2-codex, gpt-5.2, gpt-5.1-codex-max, gpt-5.1-codex, gpt-5.1, gpt-5.1-codex-mini, gpt-5-mini, gpt-4.1
[2026-02-28T01:24:43.584Z] [DEBUG] AI cache initialized: .ai_workflow/.ai_cache
[2026-02-28T01:24:43.587Z] [DEBUG] Cache miss: 0d3e9be5...
[2026-02-28T01:24:43.587Z] [DEBUG] Request Options: {"model":"gpt-4.1","temperature":0.7,"maxTokens":4000,"stream":false,"persona":"technical_writer","cache":true}
[2026-02-28T01:24:43.587Z] [DEBUG] Persona: technical_writer
[2026-02-28T01:24:43.587Z] [DEBUG] Model: gpt-4.1
[2026-02-28T01:24:43.587Z] [AI] SDK call starting — persona: technical_writer, model: gpt-4.1, prompt_chars: 3320
[2026-02-28T01:24:43.587Z] [DEBUG] Executing AI request (attempt 1/3)
[2026-02-28T01:24:43.587Z] [DEBUG] AiHelper._sendRequest called
[2026-02-28T01:24:43.587Z] [Copilot SDK] Calling sendMessage — model: gpt-4.1, prompt_length: 3320 chars
[2026-02-28T01:24:43.587Z] [DEBUG] Sending prompt...
[2026-02-28T01:24:52.452Z] [Copilot SDK] sendAndWait returned — model: gpt-4.1
[2026-02-28T01:24:52.452Z] [AI] SDK call completed — persona: technical_writer, model: gpt-4.1, response_chars: 2471, latency: 8865ms
[2026-02-28T01:24:52.453Z] ✓ AI request completed successfully
[2026-02-28T01:24:52.454Z] [DEBUG] Prompt logged to: 2026-02-28T01-24-52-453Z_0001_technical_writer.md
[2026-02-28T01:24:52.457Z] [DEBUG] Response cached: 0d3e9be5...
[2026-02-28T01:24:52.459Z] ✓ Step step_13 completed in 11648ms
[2026-02-28T01:24:52.459Z] [DEBUG] [Performance] step_13: 11.6s
[2026-02-28T01:24:52.460Z] ⚠ [WARNING] Operation 'step_13' took 11.6s (memory: 20.88MB)
[2026-02-28T01:24:52.460Z] [DEBUG] Recorded outcome for step_13: success
[2026-02-28T01:24:52.460Z] ✓ Completed: Markdown Linting (12s)
[2026-02-28T01:24:52.460Z] Executing step: AWS Serverless AI Review (step_11_6)
[2026-02-28T01:24:52.460Z] [DEBUG] Prediction for step_11_6: skip (confidence: 0.95)
[2026-02-28T01:24:52.460Z] [DEBUG] [MLOptimizer] step_11_6: predicted skippable (confidence 0.95)
[2026-02-28T01:24:52.460Z] 
→ Starting: AWS Serverless AI Review
[2026-02-28T01:24:52.460Z] ════════════════════════════════════════════════════════════
[2026-02-28T01:24:52.460Z] 🔷  Step 11.6: AWS Serverless AI Review
[2026-02-28T01:24:52.460Z] ════════════════════════════════════════════════════════════
[2026-02-28T01:24:52.460Z] Step 11.6 skipped — project kind 'location_based_service' is not aws_lbs_backend_setup
[2026-02-28T01:24:52.460Z] ✓ Step step_11_6 completed in 0ms
[2026-02-28T01:24:52.460Z] [DEBUG] [Performance] step_11_6: 0ms
[2026-02-28T01:24:52.460Z] [DEBUG] Recorded outcome for step_11_6: success
[2026-02-28T01:24:52.460Z] ✓ Completed: AWS Serverless AI Review 
[2026-02-28T01:24:52.460Z] Executing step: Prompt Engineering (step_14)
[2026-02-28T01:24:52.460Z] [DEBUG] Prediction for step_14: skip (confidence: 0.95)
[2026-02-28T01:24:52.460Z] [DEBUG] [MLOptimizer] step_14: predicted skippable (confidence 0.95)
[2026-02-28T01:24:52.460Z] 
→ Starting: Prompt Engineering
[2026-02-28T01:24:52.461Z] ════════════════════════════════════════════════════════════
[2026-02-28T01:24:52.461Z] 🔷  Step 14: Prompt Engineer Analysis
[2026-02-28T01:24:52.461Z] ════════════════════════════════════════════════════════════
[2026-02-28T01:24:52.461Z] Project type: location_based_service - analysis skipped
[2026-02-28T01:24:52.461Z] This step only runs on workflow automation projects
[2026-02-28T01:24:52.461Z] ✓ Step step_14 completed in 1ms
[2026-02-28T01:24:52.461Z] [DEBUG] [Performance] step_14: 1ms
[2026-02-28T01:24:52.461Z] [DEBUG] Recorded outcome for step_14: success
[2026-02-28T01:24:52.461Z] ✓ Completed: Prompt Engineering (0s)
[2026-02-28T01:24:52.461Z] Executing step: UX Analysis (step_15)
[2026-02-28T01:24:52.461Z] [DEBUG] Prediction for step_15: skip (confidence: 0.95)
[2026-02-28T01:24:52.461Z] [DEBUG] [MLOptimizer] step_15: predicted skippable (confidence 0.95)
[2026-02-28T01:24:52.461Z] 
→ Starting: UX Analysis
[2026-02-28T01:24:52.461Z] ════════════════════════════════════════════════════════════
[2026-02-28T01:24:52.461Z] 🔷  Step 15: UX Analysis
[2026-02-28T01:24:52.461Z] ════════════════════════════════════════════════════════════
[2026-02-28T01:24:52.466Z] Step 15: UX Analysis skipped - project type 'location_based_service' has no UI components
[2026-02-28T01:24:52.467Z] ✓ Step step_15 completed in 6ms
[2026-02-28T01:24:52.467Z] [DEBUG] [Performance] step_15: 6ms
[2026-02-28T01:24:52.467Z] [DEBUG] Recorded outcome for step_15: success
[2026-02-28T01:24:52.467Z] ✓ Completed: UX Analysis (0s)
[2026-02-28T01:24:52.467Z] Executing step: Version Update (step_16)
[2026-02-28T01:24:52.467Z] [DEBUG] Prediction for step_16: skip (confidence: 0.95)
[2026-02-28T01:24:52.467Z] [DEBUG] [MLOptimizer] step_16: predicted skippable (confidence 0.95)
[2026-02-28T01:24:52.467Z] 
→ Starting: Version Update
[2026-02-28T01:24:52.467Z] ════════════════════════════════════════════════════════════
[2026-02-28T01:24:52.467Z] 🔷  Step 16: Version Update
[2026-02-28T01:24:52.467Z] ════════════════════════════════════════════════════════════
[2026-02-28T01:24:52.467Z] Phase 1: Detecting current version...
[2026-02-28T01:24:52.467Z] ✓ Current version: 0.9.1-alpha
[2026-02-28T01:24:52.467Z] Phase 2: Determining bump type...
[2026-02-28T01:24:52.468Z] Heuristic bump type: patch
[2026-02-28T01:24:53.803Z] ✓ GitHub Copilot SDK initialized successfully
[2026-02-28T01:24:54.922Z] Available Copilot models (13): claude-sonnet-4.5, claude-haiku-4.5, claude-opus-4.5, claude-sonnet-4, gemini-3-pro-preview, gpt-5.2-codex, gpt-5.2, gpt-5.1-codex-max, gpt-5.1-codex, gpt-5.1, gpt-5.1-codex-mini, gpt-5-mini, gpt-4.1
[2026-02-28T01:24:54.960Z] [DEBUG] AI cache initialized: .ai_workflow/.ai_cache
[2026-02-28T01:24:55.041Z] [DEBUG] Cache miss: 15f80636...
[2026-02-28T01:24:55.041Z] [DEBUG] Request Options: {"model":"gpt-4.1","temperature":0.7,"maxTokens":4000,"stream":false,"persona":"devops_engineer","cache":true}
[2026-02-28T01:24:55.041Z] [DEBUG] Persona: devops_engineer
[2026-02-28T01:24:55.041Z] [DEBUG] Model: gpt-4.1
[2026-02-28T01:24:55.041Z] [AI] SDK call starting — persona: devops_engineer, model: gpt-4.1, prompt_chars: 4378
[2026-02-28T01:24:55.041Z] [DEBUG] Executing AI request (attempt 1/3)
[2026-02-28T01:24:55.041Z] [DEBUG] AiHelper._sendRequest called
[2026-02-28T01:24:55.041Z] [Copilot SDK] Calling sendMessage — model: gpt-4.1, prompt_length: 4378 chars
[2026-02-28T01:24:55.041Z] [DEBUG] Sending prompt...
[2026-02-28T01:24:59.942Z] [Copilot SDK] sendAndWait returned — model: gpt-4.1
[2026-02-28T01:24:59.942Z] [AI] SDK call completed — persona: devops_engineer, model: gpt-4.1, response_chars: 325, latency: 4901ms
[2026-02-28T01:24:59.942Z] ✓ AI request completed successfully
[2026-02-28T01:24:59.943Z] [DEBUG] Prompt logged to: 2026-02-28T01-24-59-942Z_0001_devops_engineer.md
[2026-02-28T01:24:59.946Z] [DEBUG] Response cached: 15f80636...
[2026-02-28T01:24:59.946Z] [VERSION BUMP] previous: 0.9.1-alpha → next: 0.9.2-alpha (patch)
[2026-02-28T01:24:59.946Z] ✓ New version: 0.9.1-alpha → 0.9.2-alpha
[2026-02-28T01:24:59.946Z] Phase 3: Updating versions in files...
[2026-02-28T01:24:59.948Z] Version scan found 19 file(s) referencing 0.9.1-alpha
[2026-02-28T01:25:00.005Z] ✓ Updated 19 files, skipped 16, failed 0
[2026-02-28T01:25:00.006Z] ✓ Step 16: Version update completed
[2026-02-28T01:25:00.006Z] ✓ Step step_16 completed in 7539ms
[2026-02-28T01:25:00.007Z] [DEBUG] [Performance] step_16: 7.5s
[2026-02-28T01:25:00.007Z] ⚠ [WARNING] Operation 'step_16' took 7.5s (memory: 20.45MB)
[2026-02-28T01:25:00.007Z] [DEBUG] Recorded outcome for step_16: success
[2026-02-28T01:25:00.007Z] ✓ Completed: Version Update (8s)
[2026-02-28T01:25:00.007Z] Executing step: Debugging Analysis (step_18)
[2026-02-28T01:25:00.007Z] [DEBUG] Prediction for step_18: skip (confidence: 0.95)
[2026-02-28T01:25:00.007Z] [DEBUG] [MLOptimizer] step_18: predicted skippable (confidence 0.95)
[2026-02-28T01:25:00.007Z] 
→ Starting: Debugging Analysis
[2026-02-28T01:25:00.007Z] ════════════════════════════════════════════════════════════
[2026-02-28T01:25:00.007Z] 🔷  Step 18: Debugging Analysis
[2026-02-28T01:25:00.007Z] ════════════════════════════════════════════════════════════
[2026-02-28T01:25:00.011Z] Analyzing 5 source file(s) for debugging patterns
[2026-02-28T01:25:00.012Z] Selected debugger persona: async_flow_debugger_prompt
[2026-02-28T01:25:01.278Z] ✓ GitHub Copilot SDK initialized successfully
[2026-02-28T01:25:02.320Z] Available Copilot models (13): claude-sonnet-4.5, claude-haiku-4.5, claude-opus-4.5, claude-sonnet-4, gemini-3-pro-preview, gpt-5.2-codex, gpt-5.2, gpt-5.1-codex-max, gpt-5.1-codex, gpt-5.1, gpt-5.1-codex-mini, gpt-5-mini, gpt-4.1
[2026-02-28T01:25:02.352Z] [DEBUG] AI cache initialized: .ai_workflow/.ai_cache
[2026-02-28T01:25:02.358Z] [DEBUG] Cache hit: 19568d5a...
[2026-02-28T01:25:02.360Z] ✓ Step 18 completed - debugging analysis report generated
[2026-02-28T01:25:02.360Z] ✓ Step step_18 completed in 2353ms
[2026-02-28T01:25:02.360Z] [DEBUG] [Performance] step_18: 2.4s
[2026-02-28T01:25:02.360Z] [DEBUG] Recorded outcome for step_18: success
[2026-02-28T01:25:02.360Z] ✓ Completed: Debugging Analysis (2s)
[2026-02-28T01:25:02.360Z] Executing step: Workflow Summary (step_17)
[2026-02-28T01:25:02.360Z] [DEBUG] Prediction for step_17: skip (confidence: 0.95)
[2026-02-28T01:25:02.360Z] [DEBUG] [MLOptimizer] step_17: predicted skippable (confidence 0.95)
[2026-02-28T01:25:02.360Z] 
→ Starting: Workflow Summary
[2026-02-28T01:25:02.360Z] ════════════════════════════════════════════════════════════
[2026-02-28T01:25:02.360Z] 🔷  Step 17: Workflow Summary
[2026-02-28T01:25:02.360Z] ════════════════════════════════════════════════════════════
[2026-02-28T01:25:02.360Z] Generating workflow summary report...
[2026-02-28T01:25:02.363Z] Summary report written to: .ai_workflow/summaries/workflow_20260210_223330/workflow_summary.md
[2026-02-28T01:25:02.363Z] ✓ Workflow summary generated successfully
[2026-02-28T01:25:02.363Z] ✓ Step step_17 completed in 3ms
[2026-02-28T01:25:02.363Z] [DEBUG] [Performance] step_17: 3ms
[2026-02-28T01:25:02.363Z] [DEBUG] Recorded outcome for step_17: success
[2026-02-28T01:25:02.363Z] ✓ Completed: Workflow Summary (0s)
[2026-02-28T01:25:02.363Z] Executing step: Commit Artifacts (step_0f)
[2026-02-28T01:25:02.363Z] [DEBUG] Prediction for step_0f: skip (confidence: 0.95)
[2026-02-28T01:25:02.363Z] [DEBUG] [MLOptimizer] step_0f: predicted skippable (confidence 0.95)
[2026-02-28T01:25:02.363Z] 
→ Starting: Commit Artifacts
[2026-02-28T01:25:02.363Z] ════════════════════════════════════════════════════════════
[2026-02-28T01:25:02.363Z] 🔷  Step 0f: Commit Workflow Artifacts
[2026-02-28T01:25:02.363Z] ════════════════════════════════════════════════════════════
[2026-02-28T01:25:02.369Z] Found 180 artifact file(s) to commit
[2026-02-28T01:25:02.376Z] [DEBUG] Staged 180 file(s) (forced)
[2026-02-28T01:25:02.408Z] Created commit: a764b32 - chore(docs): update docs and logs and summaries [s
[2026-02-28T01:25:02.408Z] Auto-committed 180 files: chore(docs): update docs and logs and summaries [skip ci]
[2026-02-28T01:25:02.408Z] Committed 180 artifact file(s)
[2026-02-28T01:25:02.408Z] ✓ Step step_0f completed in 45ms
[2026-02-28T01:25:02.409Z] [DEBUG] [Performance] step_0f: 45ms
[2026-02-28T01:25:02.409Z] [DEBUG] Recorded outcome for step_0f: success
[2026-02-28T01:25:02.409Z] ✓ Completed: Commit Artifacts (0s)
[2026-02-28T01:25:02.409Z] Executing step: Git Finalization (step_12)
[2026-02-28T01:25:02.409Z] [DEBUG] Prediction for step_12: skip (confidence: 0.95)
[2026-02-28T01:25:02.409Z] [DEBUG] [MLOptimizer] step_12: predicted skippable (confidence 0.95)
[2026-02-28T01:25:02.409Z] 
→ Starting: Git Finalization
[2026-02-28T01:25:02.409Z] ════════════════════════════════════════════════════════════
[2026-02-28T01:25:02.409Z] 🔷  Step 12: Git Finalization
[2026-02-28T01:25:02.409Z] ════════════════════════════════════════════════════════════
[2026-02-28T01:25:02.410Z] Analyzing git repository state...
[2026-02-28T01:25:02.428Z] Branch: main (ahead: 1, behind: 0)
[2026-02-28T01:25:02.428Z] Changes: 18 files
[2026-02-28T01:25:02.428Z] Inferred commit type: feat(implementation+tests)
[2026-02-28T01:25:02.428Z] Staging all changes...
